<?xml version="1.0" encoding="UTF-8"?>
<xs:schema attributeFormDefault="unqualified"
           elementFormDefault="qualified"
           xmlns:xs="http://www.w3.org/2001/XMLSchema"
           targetNamespace="http://com.intellect25.company.resources4/mns"
           xmlns:mns="http://com.intellect25.company.resources4/mns">

  <xs:element name="company" type="mns:companyType">

    <xs:unique name="myId">
      <xs:selector xpath=".//*"/>
      <xs:field xpath="@id"/>
    </xs:unique>

  </xs:element>

  <xs:complexType name="companyType">
    <xs:choice maxOccurs="unbounded" minOccurs="0">
      <xs:element type="mns:otherType" name="other"/>
      <xs:element type="mns:managerType" name="manager"/>
      <xs:element type="mns:workerType" name="worker"/>
    </xs:choice>
  </xs:complexType>

  <xs:complexType name="otherType">
    <xs:complexContent>
    <xs:extension base="mns:employee">
      <xs:sequence>
        <xs:element type="xs:string" name="info"/>
      </xs:sequence>
      </xs:extension>
    </xs:complexContent>
  </xs:complexType>

  <xs:complexType name="managerType">
    <xs:complexContent>
      <xs:extension base="mns:employee">
      <xs:sequence>
        <xs:element type="mns:listWorkers" name="listWorkers" minOccurs="0" maxOccurs="1"/>
      </xs:sequence>
    </xs:extension>
    </xs:complexContent>
  </xs:complexType>

  <xs:complexType name="employee" abstract="true">
    <xs:sequence>
      <xs:element type="xs:string" name="firstName"/>
      <xs:element type="xs:string" name="middleName"/>
      <xs:element type="xs:string" name="lastName"/>
      <xs:element type="xs:date" name="birthday"/>
      <xs:element type="xs:date" name="dateOfGetJob"/>
    </xs:sequence>
    <xs:attribute type="mns:id" name="id"/>
  </xs:complexType>

  <xs:complexType name="listWorkers">
    <xs:sequence>
      <xs:element type="mns:id" name="workerId" minOccurs="0" maxOccurs="unbounded"/>
    </xs:sequence>
  </xs:complexType>

  <xs:simpleType name="id">
    <xs:restriction base="xs:int">
      <xs:pattern value="[0-9]{1,4}"/>
    </xs:restriction>
  </xs:simpleType>

  <xs:complexType name="workerType">
    <xs:complexContent>
     <xs:extension base="mns:employee"/>
    </xs:complexContent>
  </xs:complexType>
</xs:schema>